{
  "$schema": "../../schema/own-lesson.schema.json",
  "id": "NN31",
  "kind": "main",
  "pack_lesson": "NN31",
  "tips": [
    "G14",
    "G09"
  ],
  "auto_exercises": {
    "E1": 1,
    "E2": 1,
    "E3": 1,
    "E4": 1,
    "E7": 1
  },
  "sentences": [
    {
      "id": "NN31-A01",
      "nl": "Binnenkort ga ik naar Den Haag.",
      "zh": "我很快要去海牙。",
      "en": "Soon I will go to The Hague."
    },
    {
      "id": "NN31-A02",
      "nl": "Ik heb vandaag gewerkt.",
      "zh": "我今天工作过了。",
      "en": "I have worked today."
    },
    {
      "id": "NN31-A03",
      "nl": "Mijn toekomst is in Nederland.",
      "zh": "我的未来在荷兰。",
      "en": "My future is in the Netherlands."
    }
  ],
  "exercises": [
    {
      "id": "NN31-O1",
      "type": "oral_complete",
      "instruction": {
        "nl": "Maak de zin af.",
        "zh": "听情景，把句子说完整。",
        "en": "Listen to the situation and finish the sentence aloud."
      },
      "items": [
        {
          "id": "NN31-O1-1",
          "context": {
            "nl": "U gaat binnenkort naar Den Haag.",
            "zh": "您很快要去海牙。",
            "en": "You will soon go to The Hague."
          },
          "start": {
            "nl": "Binnenkort ga ik ...",
            "zh": "我很快要……",
            "en": "Soon I will go ..."
          },
          "sample_answers": [
            {
              "nl": "Binnenkort ga ik naar Den Haag.",
              "zh": "我很快要去海牙。",
              "en": "Soon I will go to The Hague."
            }
          ]
        }
      ]
    },
    {
      "id": "NN31-O2",
      "type": "oral_answer",
      "instruction": {
        "nl": "Geef antwoord.",
        "zh": "听问题，开口回答。",
        "en": "Answer the question aloud."
      },
      "items": [
        {
          "id": "NN31-O2-1",
          "question": {
            "nl": "Welk land wilt u zien?",
            "zh": "您想看哪个国家？",
            "en": "Which country would you like to see?"
          },
          "sample_answers": [
            {
              "nl": "Ik wil Nederland zien.",
              "zh": "我想看荷兰。",
              "en": "I want to see the Netherlands."
            }
          ]
        }
      ]
    },
    {
      "id": "NN31-R1",
      "type": "read_passage",
      "instruction": {
        "nl": "Lees de tekst en kies het goede antwoord.",
        "zh": "读短文，选择正确答案。",
        "en": "Read the text and choose the correct answer."
      },
      "passage": [
        {
          "nl": "Hallo Iva, op 1 mei ga ik naar Rotterdam.",
          "zh": "你好，伊娃，5 月 1 日我要去鹿特丹。",
          "en": "Hi Iva, on 1 May I am going to Rotterdam."
        },
        {
          "nl": "Ik ga daar in de haven werken.",
          "zh": "我要在那里的港口工作。",
          "en": "I am going to work in the port there."
        },
        {
          "nl": "Tot 30 april werk ik nog in Den Haag.",
          "zh": "到 4 月 30 日为止，我还在海牙工作。",
          "en": "Until 30 April I still work in The Hague."
        },
        {
          "nl": "Mijn vrouw en mijn zoon gaan op 1 juni ook naar Rotterdam.",
          "zh": "我妻子和儿子 6 月 1 日也去鹿特丹。",
          "en": "My wife and my son are also going to Rotterdam on 1 June."
        },
        {
          "nl": "Tot ziens, Rachid",
          "zh": "再见，拉希德",
          "en": "Bye, Rachid"
        }
      ],
      "items": [
        {
          "id": "NN31-R1-1",
          "question": {
            "nl": "Wanneer gaat Rachid naar Rotterdam?",
            "zh": "拉希德什么时候去鹿特丹？",
            "en": "When is Rachid going to Rotterdam?"
          },
          "options": [
            {
              "nl": "Op 1 mei.",
              "zh": "5 月 1 日。",
              "en": "On 1 May."
            },
            {
              "nl": "Op 30 april.",
              "zh": "4 月 30 日。",
              "en": "On 30 April."
            },
            {
              "nl": "Op 1 juni.",
              "zh": "6 月 1 日。",
              "en": "On 1 June."
            }
          ],
          "answer": "Op 1 mei."
        },
        {
          "id": "NN31-R1-2",
          "question": {
            "nl": "Waar werkt Rachid tot 30 april?",
            "zh": "到 4 月 30 日为止，拉希德在哪里工作？",
            "en": "Where does Rachid work until 30 April?"
          },
          "options": [
            {
              "nl": "In Den Haag.",
              "zh": "在海牙。",
              "en": "In The Hague."
            },
            {
              "nl": "In de haven.",
              "zh": "在港口。",
              "en": "In the port."
            },
            {
              "nl": "In Rotterdam.",
              "zh": "在鹿特丹。",
              "en": "In Rotterdam."
            }
          ],
          "answer": "In Den Haag."
        }
      ]
    }
  ]
}
