{
  "$schema": "../../schema/own-lesson.schema.json",
  "id": "NN37",
  "kind": "main",
  "pack_lesson": "NN37",
  "tip_links": ["G17"],
  "auto_exercises": {
    "E1": 1,
    "E2": 1,
    "E3": 1,
    "E4": 1,
    "E7": 1
  },
  "sentences": [
    {
      "id": "NN37-A01",
      "nl": "Kinderen leren op school rekenen.",
      "zh": "孩子们在学校学算术。",
      "en": "Children learn arithmetic at school."
    },
    {
      "id": "NN37-A02",
      "nl": "Geschiedenis gaat over het verleden.",
      "zh": "历史讲述过去。",
      "en": "History is about the past."
    },
    {
      "id": "NN37-A03",
      "nl": "Wij zingen een liedje.",
      "zh": "我们唱一首歌。",
      "en": "We sing a song."
    }
  ],
  "exercises": [
    {
      "id": "NN37-O1",
      "type": "oral_complete",
      "instruction": {
        "nl": "Maak de zin af.",
        "zh": "听情景，把句子说完整。",
        "en": "Listen to the situation and finish the sentence aloud."
      },
      "items": [
        {
          "id": "NN37-O1-1",
          "context": {
            "nl": "U vertelt over school.",
            "zh": "您谈论学校。",
            "en": "You talk about school."
          },
          "start": {
            "nl": "Op school leren wij ...",
            "zh": "在学校我们学……",
            "en": "At school we learn ..."
          },
          "sample_answers": [
            {
              "nl": "Op school leren wij rekenen.",
              "zh": "在学校我们学算术。",
              "en": "At school we learn arithmetic."
            }
          ]
        }
      ]
    },
    {
      "id": "NN37-O2",
      "type": "oral_answer",
      "instruction": {
        "nl": "Geef antwoord.",
        "zh": "听问题，开口回答。",
        "en": "Answer the question aloud."
      },
      "items": [
        {
          "id": "NN37-O2-1",
          "question": {
            "nl": "Welk vak vindt u leuk?",
            "zh": "您喜欢哪门课？",
            "en": "Which subject do you like?"
          },
          "sample_answers": [
            {
              "nl": "Ik vind geschiedenis leuk.",
              "zh": "我喜欢历史。",
              "en": "I like history."
            }
          ]
        }
      ]
    },
    {
      "id": "NN37-R1",
      "type": "read_passage",
      "instruction": {
        "nl": "Lees de tekst en kies het goede antwoord.",
        "zh": "读短文，选择正确答案。",
        "en": "Read the text and choose the correct answer."
      },
      "passage": [
        {
          "nl": "Op school leren kinderen rekenen.",
          "zh": "孩子们在学校学算术。",
          "en": "At school children learn arithmetic."
        },
        {
          "nl": "Zij leren ook geschiedenis.",
          "zh": "他们还学历史。",
          "en": "They also learn history."
        },
        {
          "nl": "Na school zingen zij een liedje.",
          "zh": "放学后他们唱一首歌。",
          "en": "After school they sing a song."
        }
      ],
      "items": [
        {
          "id": "NN37-R1-1",
          "question": {
            "nl": "Wat leren kinderen op school?",
            "zh": "孩子们在学校学什么？",
            "en": "What do children learn at school?"
          },
          "options": [
            {
              "nl": "Rekenen.",
              "zh": "算术。",
              "en": "Arithmetic."
            },
            {
              "nl": "Wijn kopen.",
              "zh": "买葡萄酒。",
              "en": "Buying wine."
            }
          ],
          "answer": "Rekenen."
        },
        {
          "id": "NN37-R1-2",
          "question": {
            "nl": "Wat zingen zij na school?",
            "zh": "放学后他们唱什么？",
            "en": "What do they sing after school?"
          },
          "options": [
            {
              "nl": "Een liedje.",
              "zh": "一首歌。",
              "en": "A song."
            },
            {
              "nl": "Een antwoord.",
              "zh": "一个答案。",
              "en": "An answer."
            }
          ],
          "answer": "Een liedje."
        }
      ]
    }
  ]
}
