{
  "$schema": "../../schema/own-lesson.schema.json",
  "id": "NN35",
  "kind": "main",
  "pack_lesson": "NN35",
  "tips": [
    "G10"
  ],
  "auto_exercises": {
    "E1": 1,
    "E2": 1,
    "E3": 1,
    "E4": 1,
    "E7": 1
  },
  "sentences": [
    {
      "id": "NN35-A01",
      "nl": "Ik heb een afspraak met mijn arts.",
      "zh": "我和我的医生有个预约。",
      "en": "I have an appointment with my doctor."
    },
    {
      "id": "NN35-A02",
      "nl": "De wachtkamer is dichtbij.",
      "zh": "候诊室就在附近。",
      "en": "The waiting room is nearby."
    },
    {
      "id": "NN35-A03",
      "nl": "Mijn schouder doet pijn.",
      "zh": "我的肩膀疼。",
      "en": "My shoulder hurts."
    }
  ],
  "exercises": [
    {
      "id": "NN35-O1",
      "type": "oral_complete",
      "instruction": {
        "nl": "Maak de zin af.",
        "zh": "听情景，把句子说完整。",
        "en": "Listen to the situation and finish the sentence aloud."
      },
      "items": [
        {
          "id": "NN35-O1-1",
          "context": {
            "nl": "U heeft pijn in uw schouder.",
            "zh": "您的肩膀疼。",
            "en": "Your shoulder hurts."
          },
          "start": {
            "nl": "Mijn schouder ...",
            "zh": "我的肩膀……",
            "en": "My shoulder ..."
          },
          "sample_answers": [
            {
              "nl": "Mijn schouder doet pijn.",
              "zh": "我的肩膀疼。",
              "en": "My shoulder hurts."
            }
          ]
        }
      ]
    },
    {
      "id": "NN35-O2",
      "type": "oral_answer",
      "instruction": {
        "nl": "Geef antwoord.",
        "zh": "听问题，开口回答。",
        "en": "Answer the question aloud."
      },
      "items": [
        {
          "id": "NN35-O2-1",
          "question": {
            "nl": "Heeft u een afspraak met de arts?",
            "zh": "您约了医生吗？",
            "en": "Do you have an appointment with the doctor?"
          },
          "sample_answers": [
            {
              "nl": "Ja, ik heb een afspraak.",
              "zh": "是的，我有预约。",
              "en": "Yes, I have an appointment."
            }
          ]
        }
      ]
    },
    {
      "id": "NN35-R1",
      "type": "read_passage",
      "instruction": {
        "nl": "Lees de tekst en kies het goede antwoord.",
        "zh": "读短文，选择正确答案。",
        "en": "Read the text and choose the correct answer."
      },
      "passage": [
        {
          "nl": "Dag mevrouw Jansen, u heeft een afspraak bij de tandarts op donderdag 9 oktober om 14.15 uur.",
          "zh": "扬森女士您好，您 10 月 9 日星期四 14:15 约了牙医。",
          "en": "Hello Mrs Jansen, you have an appointment with the dentist on Thursday 9 October at 14.15."
        },
        {
          "nl": "De praktijk is naast het ziekenhuis.",
          "zh": "诊所在医院旁边。",
          "en": "The practice is next to the hospital."
        },
        {
          "nl": "Wilt u om 14.05 uur in de wachtkamer zijn?",
          "zh": "请您 14:05 到候诊室。",
          "en": "Would you be in the waiting room at 14.05?"
        },
        {
          "nl": "Kunt u niet? Bel ons dan voor woensdag 12.00 uur.",
          "zh": "来不了？请在星期三 12 点前给我们打电话。",
          "en": "Can't you make it? Then call us before Wednesday 12.00."
        },
        {
          "nl": "Anders moet u de afspraak toch betalen.",
          "zh": "否则这次预约您还是要付钱。",
          "en": "Otherwise you will still have to pay for the appointment."
        }
      ],
      "items": [
        {
          "id": "NN35-R1-1",
          "question": {
            "nl": "Hoe laat is de afspraak?",
            "zh": "预约是几点？",
            "en": "What time is the appointment?"
          },
          "options": [
            {
              "nl": "Om 14.15 uur.",
              "zh": "14:15。",
              "en": "At 14.15."
            },
            {
              "nl": "Om 14.05 uur.",
              "zh": "14:05。",
              "en": "At 14.05."
            },
            {
              "nl": "Om 12.00 uur.",
              "zh": "12 点。",
              "en": "At 12.00."
            }
          ],
          "answer": "Om 14.15 uur."
        },
        {
          "id": "NN35-R1-2",
          "question": {
            "nl": "Mevrouw Jansen kan niet. Wat moet ze doen?",
            "zh": "扬森女士来不了。她要怎么做？",
            "en": "Mrs Jansen can't make it. What must she do?"
          },
          "options": [
            {
              "nl": "Voor woensdag 12.00 uur bellen.",
              "zh": "星期三 12 点前打电话。",
              "en": "Call before Wednesday 12.00."
            },
            {
              "nl": "Om 14.05 uur in de wachtkamer zijn.",
              "zh": "14:05 到候诊室。",
              "en": "Be in the waiting room at 14.05."
            },
            {
              "nl": "Naar het ziekenhuis gaan.",
              "zh": "去医院。",
              "en": "Go to the hospital."
            }
          ],
          "answer": "Voor woensdag 12.00 uur bellen."
        }
      ]
    }
  ]
}
