{
  "$schema": "../../schema/own-lesson.schema.json",
  "id": "NN29",
  "kind": "main",
  "pack_lesson": "NN29",
  "tip_links": ["G08"],
  "auto_exercises": {
    "E1": 2,
    "E2": 1,
    "E3": 2,
    "E4": 1,
    "E7": 1
  },
  "sentences": [
    {
      "id": "NN29-A01",
      "nl": "Ik ben ziek.",
      "zh": "我病了。",
      "en": "I am ill."
    },
    {
      "id": "NN29-A02",
      "nl": "Ik voel me slecht.",
      "zh": "我感觉不舒服。",
      "en": "I feel bad."
    },
    {
      "id": "NN29-A03",
      "nl": "Ik bel de huisarts.",
      "zh": "我给家庭医生打电话。",
      "en": "I'll call the GP."
    },
    {
      "id": "NN29-A04",
      "nl": "Wandelen is gezond.",
      "zh": "散步对身体好。",
      "en": "Walking is healthy."
    }
  ],
  "exercises": [
    {
      "id": "NN29-O1",
      "type": "oral_complete",
      "instruction": {
        "nl": "Maak de zin af.",
        "zh": "听情景，把句子说完整。",
        "en": "Listen to the situation and finish the sentence aloud."
      },
      "items": [
        {
          "id": "NN29-O1-1",
          "context": {
            "nl": "U bent ziek. U belt de huisarts.",
            "zh": "您病了，给家庭医生打电话。",
            "en": "You are ill. You call the GP."
          },
          "start": {
            "nl": "Goedemorgen, ik ...",
            "zh": "早上好，我……",
            "en": "Good morning, I ..."
          },
          "sample_answers": [
            {
              "nl": "Goedemorgen, ik voel me niet goed.",
              "zh": "早上好，我身体不舒服。",
              "en": "Good morning, I don't feel well."
            },
            {
              "nl": "Goedemorgen, ik ben ziek.",
              "zh": "早上好，我病了。",
              "en": "Good morning, I am ill."
            }
          ]
        }
      ]
    },
    {
      "id": "NN29-O2",
      "type": "oral_answer",
      "instruction": {
        "nl": "Geef antwoord.",
        "zh": "听问题，开口回答。",
        "en": "Answer the question aloud."
      },
      "items": [
        {
          "id": "NN29-O2-1",
          "question": {
            "nl": "Wat doet u voor een gezond leven?",
            "zh": "您为了健康做些什么？",
            "en": "What do you do for a healthy life?"
          },
          "sample_answers": [
            {
              "nl": "Ik wandel veel.",
              "zh": "我常散步。",
              "en": "I walk a lot."
            },
            {
              "nl": "Ik rook niet en ik beweeg regelmatig.",
              "zh": "我不抽烟，经常运动。",
              "en": "I don't smoke and I exercise regularly."
            }
          ]
        }
      ]
    }
  ]
}
