{
  "$schema": "../../schema/own-lesson.schema.json",
  "id": "NN65",
  "kind": "main",
  "pack_lesson": "NN65",
  "auto_exercises": {
    "E1": 1,
    "E2": 1,
    "E3": 1,
    "E4": 1,
    "E7": 1
  },
  "sentences": [
    {
      "id": "NN65-A01",
      "nl": "Ik ben trots op mijn Nederlands.",
      "zh": "我为自己的荷兰语感到骄傲。",
      "en": "I am proud of my Dutch."
    },
    {
      "id": "NN65-A02",
      "nl": "Ik ben benieuwd naar het examen.",
      "zh": "我很想知道考试会怎么样。",
      "en": "I am curious about the exam."
    },
    {
      "id": "NN65-A03",
      "nl": "Ik ben niet meer bang om Nederlands te spreken.",
      "zh": "我不再怕说荷兰语了。",
      "en": "I am no longer afraid to speak Dutch."
    }
  ],
  "exercises": [
    {
      "id": "NN65-O1",
      "type": "oral_complete",
      "instruction": {
        "nl": "Maak de zin af.",
        "zh": "听情景，把句子说完整。",
        "en": "Listen to the situation and finish the sentence aloud."
      },
      "items": [
        {
          "id": "NN65-O1-1",
          "context": {
            "nl": "U neemt afscheid van de docent.",
            "zh": "您和老师告别。",
            "en": "You say goodbye to the teacher."
          },
          "start": {
            "nl": "Bedankt voor ...",
            "zh": "谢谢……",
            "en": "Thank you for ..."
          },
          "sample_answers": [
            {
              "nl": "Bedankt voor de leuke lessen!",
              "zh": "谢谢您上的有意思的课！",
              "en": "Thank you for the nice lessons!"
            }
          ]
        }
      ]
    },
    {
      "id": "NN65-O2",
      "type": "oral_answer",
      "instruction": {
        "nl": "Geef antwoord.",
        "zh": "听问题，开口回答。",
        "en": "Answer the question aloud."
      },
      "items": [
        {
          "id": "NN65-O2-1",
          "question": {
            "nl": "Bent u tevreden over uw Nederlands?",
            "zh": "您对自己的荷兰语满意吗？",
            "en": "Are you happy with your Dutch?"
          },
          "sample_answers": [
            {
              "nl": "Ja, ik ben heel tevreden.",
              "zh": "满意，我很满意。",
              "en": "Yes, I am very happy with it."
            },
            {
              "nl": "Ja, maar ik wil nog veel leren.",
              "zh": "满意，不过我还想多学。",
              "en": "Yes, but I still want to learn a lot."
            }
          ]
        }
      ]
    },
    {
      "id": "NN65-R1",
      "type": "read_passage",
      "instruction": {
        "nl": "Lees de tekst en kies het goede antwoord.",
        "zh": "读短文，选择正确答案。",
        "en": "Read the text and choose the correct answer."
      },
      "passage": [
        {
          "nl": "Beste allemaal,",
          "zh": "大家好：",
          "en": "Dear all,"
        },
        {
          "nl": "Vandaag, maandag 24 november, is de cursus klaar.",
          "zh": "今天 11 月 24 日星期一，课程结束了。",
          "en": "Today, Monday 24 November, the course is over."
        },
        {
          "nl": "Het examen is op dinsdag 2 december, van 9.30 tot 12.00 uur.",
          "zh": "考试在 12 月 2 日星期二，9:30 到 12:00。",
          "en": "The exam is on Tuesday 2 December, from 9.30 to 12.00."
        },
        {
          "nl": "Neem een pen mee; om 9.15 uur gaat de deur dicht.",
          "zh": "请带笔；9:15 关门。",
          "en": "Bring a pen; the door closes at 9.15."
        },
        {
          "nl": "Ik ben trots op jullie en ik wens jullie veel succes!",
          "zh": "我为你们骄傲，祝你们考试顺利！",
          "en": "I am proud of you and I wish you lots of success!"
        },
        {
          "nl": "Groeten, Anna",
          "zh": "祝好，安娜",
          "en": "Regards, Anna"
        }
      ],
      "items": [
        {
          "id": "NN65-R1-1",
          "question": {
            "nl": "Hoe laat begint het examen?",
            "zh": "考试几点开始？",
            "en": "What time does the exam start?"
          },
          "options": [
            {
              "nl": "Om 9.30 uur.",
              "zh": "9:30。",
              "en": "At 9.30."
            },
            {
              "nl": "Om 9.15 uur.",
              "zh": "9:15。",
              "en": "At 9.15."
            },
            {
              "nl": "Om 12.00 uur.",
              "zh": "12:00。",
              "en": "At 12.00."
            }
          ],
          "answer": "Om 9.30 uur."
        },
        {
          "id": "NN65-R1-2",
          "question": {
            "nl": "Op welke dag is het examen?",
            "zh": "考试是哪天？",
            "en": "On which day is the exam?"
          },
          "options": [
            {
              "nl": "Op dinsdag 2 december.",
              "zh": "12 月 2 日星期二。",
              "en": "On Tuesday 2 December."
            },
            {
              "nl": "Op maandag 24 november.",
              "zh": "11 月 24 日星期一。",
              "en": "On Monday 24 November."
            },
            {
              "nl": "Op maandag 2 december.",
              "zh": "12 月 2 日星期一。",
              "en": "On Monday 2 December."
            }
          ],
          "answer": "Op dinsdag 2 december."
        }
      ]
    }
  ]
}
